{
  "$schema": "https://json-schema.org/draft/2020-12/schema",
  "$id": "https://flowmemory.local/schemas/flowmemory/production-export-snapshot.schema.json",
  "title": "FlowChain Export Snapshot V0",
  "type": "object",
  "additionalProperties": false,
  "required": [
    "schema",
    "chainId",
    "networkProfile",
    "genesisHash",
    "blockHeight",
    "blockHash",
    "stateRoot",
    "stateRootManifest",
    "accounts",
    "balances",
    "tokens",
    "pools",
    "bridgeCredits",
    "withdrawals",
    "objectStoreRefs",
    "finalityReceipts",
    "provenance",
    "productionReady"
  ],
  "properties": {
    "schema": {
      "const": "flowchain.production_l1.export_snapshot.v0",
      "x-owner": "runtime"
    },
    "chainId": {
      "type": "string",
      "pattern": "^(0|[1-9][0-9]*)$",
      "x-owner": "runtime"
    },
    "networkProfile": {
      "type": "string",
      "enum": [
        "flowchain-local-private",
        "flowchain-local-multinode",
        "flowchain-base8453-pilot"
      ],
      "x-owner": "runtime"
    },
    "genesisHash": {
      "type": "string",
      "pattern": "^0x[0-9a-fA-F]{64}$",
      "x-owner": "runtime"
    },
    "blockHeight": {
      "type": "string",
      "pattern": "^(0|[1-9][0-9]*)$",
      "x-owner": "runtime"
    },
    "blockHash": {
      "type": "string",
      "pattern": "^0x[0-9a-fA-F]{64}$",
      "x-owner": "runtime"
    },
    "stateRoot": {
      "type": "string",
      "pattern": "^0x[0-9a-fA-F]{64}$",
      "x-owner": "runtime"
    },
    "stateRootManifest": {
      "$ref": "https://flowmemory.local/schemas/flowmemory/production-state-root-manifest.schema.json",
      "x-owner": "runtime"
    },
    "accounts": {
      "type": "array",
      "items": {
        "$ref": "https://flowmemory.local/schemas/flowmemory/production-account-public-metadata.schema.json"
      },
      "x-owner": "wallet"
    },
    "balances": {
      "type": "array",
      "x-owner": "runtime"
    },
    "tokens": {
      "type": "array",
      "x-owner": "runtime"
    },
    "pools": {
      "type": "array",
      "x-owner": "runtime"
    },
    "bridgeCredits": {
      "type": "array",
      "x-owner": "bridge"
    },
    "withdrawals": {
      "type": "array",
      "x-owner": "bridge"
    },
    "objectStoreRefs": {
      "type": "array",
      "x-owner": "runtime"
    },
    "finalityReceipts": {
      "type": "array",
      "items": {
        "$ref": "https://flowmemory.local/schemas/flowmemory/production-finality-receipt.schema.json"
      },
      "x-owner": "consensus"
    },
    "provenance": {
      "type": "object",
      "additionalProperties": false,
      "required": [
        "generatedBy",
        "schemaNames",
        "fixturePaths",
        "validationCommands"
      ],
      "properties": {
        "generatedBy": {
          "type": "string",
          "minLength": 1,
          "x-owner": "rpc"
        },
        "schemaNames": {
          "type": "array",
          "items": {
            "type": "string"
          },
          "minItems": 1,
          "x-owner": "rpc"
        },
        "fixturePaths": {
          "type": "array",
          "items": {
            "type": "string"
          },
          "minItems": 1,
          "x-owner": "rpc"
        },
        "validationCommands": {
          "type": "array",
          "items": {
            "type": "string"
          },
          "minItems": 1,
          "x-owner": "rpc"
        }
      },
      "x-owner": "rpc"
    },
    "productionReady": {
      "const": false,
      "x-owner": "hq-review"
    }
  },
  "$defs": {
    "hex32": {
      "type": "string",
      "pattern": "^0x[0-9a-fA-F]{64}$"
    },
    "address": {
      "type": "string",
      "pattern": "^0x[0-9a-fA-F]{40}$"
    },
    "publicKey": {
      "type": "string",
      "pattern": "^0x(02|03)[0-9a-fA-F]{64}$"
    },
    "uintString": {
      "type": "string",
      "pattern": "^(0|[1-9][0-9]*)$"
    },
    "isoTime": {
      "type": "string",
      "format": "date-time"
    },
    "networkProfile": {
      "type": "string",
      "enum": [
        "flowchain-local-private",
        "flowchain-local-multinode",
        "flowchain-base8453-pilot"
      ]
    },
    "payloadType": {
      "type": "string",
      "enum": [
        "native_transfer",
        "faucet_funding",
        "bridge_credit",
        "token_launch",
        "token_mint",
        "token_transfer",
        "pool_create",
        "add_liquidity",
        "remove_liquidity",
        "swap",
        "withdrawal_intent",
        "validator_authority_config",
        "finality_vote",
        "finality_certificate",
        "agent_account_update",
        "model_passport_update",
        "work_receipt_update",
        "artifact_availability_proof_update",
        "verifier_module_update",
        "verifier_report_update",
        "memory_cell_update",
        "challenge_update",
        "finality_receipt_update"
      ]
    },
    "eventType": {
      "type": "string",
      "enum": [
        "NativeTransferRecorded",
        "FaucetFundingRecorded",
        "BridgeCreditApplied",
        "TokenLaunched",
        "TokenMinted",
        "TokenTransferred",
        "PoolCreated",
        "LiquidityAdded",
        "LiquidityRemoved",
        "SwapExecuted",
        "WithdrawalIntentRecorded",
        "ValidatorAuthorityConfigured",
        "FinalityVoteRecorded",
        "FinalityCertificateRecorded",
        "ObjectLifecycleUpdated"
      ]
    },
    "stateComponent": {
      "type": "string",
      "enum": [
        "accounts",
        "balances",
        "tokens",
        "pools",
        "lp_positions",
        "bridge_credits",
        "withdrawals",
        "object_store",
        "finality",
        "validator_state"
      ]
    }
  }
}
