{
  "schema": "flowchain.production_l1.export_snapshot.v0",
  "chainId": "7428453",
  "networkProfile": "flowchain-base8453-pilot",
  "genesisHash": "0x0826d4c5093c967d57dd5239b8c24e089dc898942291b5f3050a129887041e7f",
  "blockHeight": "1",
  "blockHash": "0x4e38335dd2b0163f75d631c9b6648b6cc59f83e2b3a32e72d301322ac27148c4",
  "stateRoot": "0x716ccaf7e8946591973d4614d41ba39c047ef7e89bd67d62f1aa6d90b99133ef",
  "stateRootManifest": {
    "schema": "flowchain.production_l1.state_root_manifest.v0",
    "chainId": "7428453",
    "networkProfile": "flowchain-base8453-pilot",
    "genesisHash": "0x0826d4c5093c967d57dd5239b8c24e089dc898942291b5f3050a129887041e7f",
    "stateRoot": "0x716ccaf7e8946591973d4614d41ba39c047ef7e89bd67d62f1aa6d90b99133ef",
    "stateRootAlgorithm": "keccak256(canonical-json-sorted-keys-v0)",
    "components": [
      {
        "component": "accounts",
        "root": "0xf4914d4bb9ced10596986f52eefbe15e6b775c8b0855d51f85addd175b61e046",
        "count": 6,
        "ownerAgent": "wallet",
        "inputs": [
          "accountId",
          "publicKey",
          "address",
          "roleFlags",
          "nonceDomain"
        ]
      },
      {
        "component": "balances",
        "root": "0x8a4fbb966efb61bd6e8f78fb7b8b510086b2650504654cc82a61d3ed97ac4d1c",
        "count": 7,
        "ownerAgent": "runtime",
        "inputs": [
          "accountId",
          "assetId",
          "amount"
        ]
      },
      {
        "component": "tokens",
        "root": "0x542972588a71cf20b19e18681adc3bfbdcf7ca2fed4d4e60858e7679c2cbe238",
        "count": 1,
        "ownerAgent": "runtime",
        "inputs": [
          "tokenId",
          "symbol",
          "decimals",
          "totalSupply"
        ]
      },
      {
        "component": "pools",
        "root": "0x66666b609cd2486e0b688b8967452a54b49e684f587c107c8392d58b62ae3897",
        "count": 1,
        "ownerAgent": "runtime",
        "inputs": [
          "poolId",
          "baseAssetId",
          "quoteAssetId",
          "reserves"
        ]
      },
      {
        "component": "lp_positions",
        "root": "0xac45ae606ad56a72fd38b75aad52ed9b46365dfcca5b7679e3f7397d88ef05d3",
        "count": 1,
        "ownerAgent": "runtime",
        "inputs": [
          "lpPositionId",
          "poolId",
          "ownerAccountId",
          "lpUnits"
        ]
      },
      {
        "component": "bridge_credits",
        "root": "0x0f91f6d8d6a014b6b9e5c271e8a746256c4ef3b00c2194e0b858e405b7044b9a",
        "count": 1,
        "ownerAgent": "bridge",
        "inputs": [
          "creditId",
          "observationId",
          "accountId",
          "assetId",
          "amount"
        ]
      },
      {
        "component": "withdrawals",
        "root": "0x179cf78b41131caefd13d557b73e73258fcb027e103007115deeb98e7755959f",
        "count": 1,
        "ownerAgent": "bridge",
        "inputs": [
          "withdrawalIntentId",
          "accountId",
          "assetId",
          "amount",
          "releaseEvidenceId"
        ]
      },
      {
        "component": "object_store",
        "root": "0x96cca38dd6e86995a2b3551676a5c5777c3d270762cab8769771f840a9ac23fd",
        "count": 9,
        "ownerAgent": "runtime",
        "inputs": [
          "objectType",
          "objectId",
          "objectHash",
          "status"
        ]
      },
      {
        "component": "finality",
        "root": "0xbc714da6fb6a0957172d578e52e611e35c2f5c7a5433435c31736e6da2abf6f6",
        "count": 1,
        "ownerAgent": "consensus",
        "inputs": [
          "height",
          "status",
          "certificateId"
        ]
      },
      {
        "component": "validator_state",
        "root": "0x6ae2131489fb1d27c5a6786fe058ad7a4d70edc598c0d766028fc1f4d1532290",
        "count": 1,
        "ownerAgent": "consensus",
        "inputs": [
          "authorityId",
          "accountId",
          "votingPower",
          "status"
        ]
      }
    ],
    "stateComponents": {
      "accounts": [
        {
          "schema": "flowchain.production_l1.account_public_metadata.v0",
          "accountId": "0xd6d0a8eb15ca2da58ecde78beb56830564ea3302b3af4215cdccb3a08ff34908",
          "label": "alice-user",
          "publicKey": "0x02a332e6b5637c5584cf1b19a24410a74a86715d1d054f5bf1f1054ed789fae974",
          "address": "0x160c4dcc0bb4bdc9bdbdd3b652dacdb0a95731d3",
          "addressDerivation": {
            "algorithm": "keccak256(compressedSecp256k1PublicKey)[12:32]",
            "preimageFields": [
              "publicKey",
              "chainId",
              "networkProfile"
            ],
            "chainIdBinding": true
          },
          "nonceDomain": {
            "domainId": "0x02a7170b32f06e676036e7f0df7a0c1b5aed6d97730abc30f29e6a6d22b610ac",
            "nextNonce": "1",
            "replayScope": "chainId+networkProfile+genesisHash+accountId"
          },
          "roleFlags": {
            "user": true,
            "validator": false,
            "bridgeOperator": false,
            "deployer": true,
            "relayer": false,
            "emergencyOperator": false
          },
          "metadataHash": "0x1c114222c149606293a4dac2c2b8bd53d64517a2cb4804b13c560e6f0e3e09de",
          "status": "active",
          "productionReady": false
        },
        {
          "schema": "flowchain.production_l1.account_public_metadata.v0",
          "accountId": "0xc687acd2a8f82c43e7b5e5fc8c3df132aa69becb29a71abcdfe6461a2e6e774a",
          "label": "bob-user",
          "publicKey": "0x02bd133d4df63458ed49a0d7acde36d546b80c735f04d9a37eb428f1d92505b6be",
          "address": "0xc8d2f10666e1216121f6449f0fc5726f63590aa7",
          "addressDerivation": {
            "algorithm": "keccak256(compressedSecp256k1PublicKey)[12:32]",
            "preimageFields": [
              "publicKey",
              "chainId",
              "networkProfile"
            ],
            "chainIdBinding": true
          },
          "nonceDomain": {
            "domainId": "0x8a6124844f49d9390c78a1dfd812c43c1963edf9be78b4154bc50fabf0e12f9a",
            "nextNonce": "1",
            "replayScope": "chainId+networkProfile+genesisHash+accountId"
          },
          "roleFlags": {
            "user": true,
            "validator": false,
            "bridgeOperator": false,
            "deployer": false,
            "relayer": false,
            "emergencyOperator": false
          },
          "metadataHash": "0xd7456e440b78c346aa02b5fff11c181d45d40c691d836e571d464a595db02008",
          "status": "active",
          "productionReady": false
        },
        {
          "schema": "flowchain.production_l1.account_public_metadata.v0",
          "accountId": "0xef8fcf1e5560df82860c4de608453cc69a07478b1c7472b6fa7f5834d7d0c46d",
          "label": "validator-one",
          "publicKey": "0x021d45040882bbe0d3d1ff6ed7476a4b533e17b00633d81cff5cd15479c3c0bd22",
          "address": "0xd0c3c122262ba1116de221d5fbf4505357b97e8a",
          "addressDerivation": {
            "algorithm": "keccak256(compressedSecp256k1PublicKey)[12:32]",
            "preimageFields": [
              "publicKey",
              "chainId",
              "networkProfile"
            ],
            "chainIdBinding": true
          },
          "nonceDomain": {
            "domainId": "0x8aca75dd306f43261a9c58812a426a62ddf72e5a0823fe7ef6c4e0aff78b42d9",
            "nextNonce": "1",
            "replayScope": "chainId+networkProfile+genesisHash+accountId"
          },
          "roleFlags": {
            "user": false,
            "validator": true,
            "bridgeOperator": false,
            "deployer": false,
            "relayer": false,
            "emergencyOperator": false
          },
          "metadataHash": "0x18e55b4da0218551072142ab2f110626c3f47f0c6f2a8fc5dbb5efb2fa3b34eb",
          "status": "active",
          "productionReady": false
        },
        {
          "schema": "flowchain.production_l1.account_public_metadata.v0",
          "accountId": "0xb456f55c243edcb1372f27f199f9e68b25d0909f5d2d90ec4e20fbe6de7098b4",
          "label": "bridge-relayer",
          "publicKey": "0x02f90ad32b15b53c0e4abd4f2f0de6db96dbe0adee1dab1736b0cf596070f7ef05",
          "address": "0x633621fec8e01f8346130d81c26be8e33d1dcea9",
          "addressDerivation": {
            "algorithm": "keccak256(compressedSecp256k1PublicKey)[12:32]",
            "preimageFields": [
              "publicKey",
              "chainId",
              "networkProfile"
            ],
            "chainIdBinding": true
          },
          "nonceDomain": {
            "domainId": "0x346974a0aa8346f9759dde1d56bb8962a36eb013ca5e7f8c1b8e673fcfebd08a",
            "nextNonce": "1",
            "replayScope": "chainId+networkProfile+genesisHash+accountId"
          },
          "roleFlags": {
            "user": false,
            "validator": false,
            "bridgeOperator": true,
            "deployer": false,
            "relayer": true,
            "emergencyOperator": false
          },
          "metadataHash": "0x09d6e50d1093be697a68f09a0a8c99c1c8b072dd71ea832305d5153ae585a3ff",
          "status": "active",
          "productionReady": false
        },
        {
          "schema": "flowchain.production_l1.account_public_metadata.v0",
          "accountId": "0x9f7090c47663019f3d7647a2d4b5895a529e9dbac911bb2fde2c359828cbb3b8",
          "label": "bridge-release-authority",
          "publicKey": "0x02be094d43f51fb0e267c4ed5767bf26ef1370dc3c7756d1399d8e152c3a59b602",
          "address": "0xdb523727f85b4f6d0ff5f62fc4d6c25a337af90d",
          "addressDerivation": {
            "algorithm": "keccak256(compressedSecp256k1PublicKey)[12:32]",
            "preimageFields": [
              "publicKey",
              "chainId",
              "networkProfile"
            ],
            "chainIdBinding": true
          },
          "nonceDomain": {